{
  "meta": {
    "generated_at": "2026-05-06T17:30:00Z",
    "methodology_version": "v2.0.0",
    "inputs_used": ["source_code", "design_specs", "test_code"],
    "confidence": 0.95,
    "formula_version": "v1"
  },
  "derivation_source": {
    "test_spec_path": ".aimd/output/test-spec.json",
    "behavior_spec_path": ".aimd/output/behavior-spec.json"
  },
  "modules": [
    {
      "id": "IMPL-USER-001",
      "tc_refs": ["TC-USER-001"],
      "bhv_refs": ["BHV-USER-001"],
      "framework": "pure-node-typescript",
      "source_files": [
        "target/src/user.service.ts",
        "target/src/email-uniqueness-guard.ts",
        "target/src/user-store.ts"
      ],
      "commit_hash": "321eeb3bb15f476b3fd0e55fbd8523901992bd20",
      "source_evidence": "export class UserService { register(email, password) { if (password.length < MIN_PASSWORD_LENGTH) throw new PasswordTooShortError(); this.guard.assertAvailable(email); return this.store.add(email, password); } }"
    },
    {
      "id": "IMPL-USER-002",
      "tc_refs": ["TC-USER-002"],
      "bhv_refs": ["BHV-USER-002"],
      "framework": "pure-node-typescript",
      "source_files": [
        "target/src/user.service.ts",
        "target/src/user-store.ts"
      ],
      "commit_hash": "321eeb3bb15f476b3fd0e55fbd8523901992bd20",
      "source_evidence": "login(email, password) { const user = this.store.findByEmail(email); if (!user) return null; if (user.password !== password) return null; return user; }"
    }
  ],
  "test_pass_evidence": {
    "test_runner_version": "vitest 1.6.1",
    "test_runner_stdout_path": ".aimd/output/evidence/test-stdout-green.txt",
    "test_runner_stderr_path": ".aimd/output/evidence/test-stderr-green.txt",
    "invocation_timestamp": "2026-05-06T17:11:00Z",
    "duration_ms": 153,
    "pass_count": 6,
    "fail_count": 0,
    "skip_count": 0,
    "reproduction_command": "cd target && npx vitest run --reporter=json --outputFile=../.aimd/output/evidence/vitest-green.json",
    "result_hash": "sha256:838e7025761a41f3803eb05c627f2c1840f268ff9963dfc2f2a418b2b735895c",
    "report_format": "vitest_json",
    "flaky_retries_count": 0
  },
  "coverage": {
    "link_coverage": {
      "by_acceptance_criteria": 1.0,
      "by_business_rule": 1.0,
      "by_use_case": 1.0,
      "threshold": 0.85,
      "severity_floor": {
        "critical": 1.0,
        "high": 1.0,
        "medium": 1.0,
        "low": 1.0
      }
    },
    "test_pass_rate": 1.0,
    "line_coverage": 0.95,
    "branch_coverage": 0.92
  },
  "human_review": {
    "gate_4_intervention_pct": 0.10,
    "intervention_log": [
      "gate-4 user-decision: go (validator pass / 5종 물증 7 필드 정합 / commit 321eeb3 source verified)"
    ]
  },
  "chain_attempt": {
    "attempt_n": 1,
    "retry_cap": 3,
    "revisit_count": 0
  }
}
